{
  "active": true,
  "configured": true,
  "createdAt": "2026-10-11T01:00:00Z",
  "error": null,
  "name": "DSH",
  "phase": {
    "code": "syncing",
    "message": "正在同步 DSH 会话…",
    "retryable": true
  },
  "runtimeId": "rti_dsh_local_01",
  "runtimeType": "dsh",
  "startedAt": "2026-10-11T01:00:05Z",
  "status": "starting",
  "stoppedAt": null,
  "updatedAt": "2026-10-11T01:00:06Z"
}
